document_id,date,title,pdf_url,description,description_source
C09000005,3/12/1998,"EU Enlargement: An American Perspective Remarks by Deputy Secretary of State Strobe Talbott to the conference A Wider Europe: EU Enlargement and US interests The British Embassy, Washington March 12, 1998 w/Attachment(s)",https://foia.state.gov/DOCUMENTS/FOIA_L_Jan2024/FL-2017-13804/DOC_0C09000005/C09000005.pdf,"State Department FOIA record C09000005, dated 10/14/1995, is titled ""October 14, 1995 Note from Strobe Talbott to Chris"". Released under FOIA case F-2017-13804 in the Strobe Talbott collection. Searchable text was not extracted; consult the source PDF for full content.",metadata
C09000091,3/12/1998,"March 12, 1998 Letter From Strobe Talbott To Nuzhet Kandemir w/Attachment(s)",https://foia.state.gov/DOCUMENTS/FOIA_L_Oct2023/FL-2017-13804/DOC_0C09000091/C09000091.pdf,"State Department FOIA record C09000091, dated 2/3/1995, is titled ""OFFICIAL - INFORMAL"". The released text begins: ""TOM, I'D I 'D BE BE GRATEFUL If YOU COULD PASS GRATEFUL IF PASS THE THE FOLLOWING FOLL OWING CONFIDENTIAL CONFIDENTIAL NOTE FROM FROM ME TO MAMEDOV. THANKS ALSO, FOR FOR YOUR FINE WORK ON THIS ONE, BEST, YOUR FINE WORK ON THIS ONE.""",pdf
C09000024,3/21/1998,"March 21, 1998 Note From Strobe Talbott To Steve Sestanovich and Toria Nuland",https://foia.state.gov/DOCUMENTS/FOIA_L_Sep2023/FL-2017-13804/DOC_0C09000024/C09000024.pdf,"State Department FOIA record C09000024, dated 4/26/1996, is titled ""Handwritten Letter"". The released text begins: ""GORDON SMITH TO: I' , 613-944-0856 TEL: FAX: DEAR GORDON: MANY THANKS FOR YOUR BIRTHDAY MESSAGE: GREETING. I'LL AGE GRACEFULLY IN THIS JOB IF I CAN ARRANGE TO HAVE MORE FRIENDS, COLLEAGUES AND COUNTERPARTS LIKE YOURSELF.""",pdf
C09000034,3/24/1998,"March 24, 1998 Note From Strobe Talbott To Tom Pickering and Bonnie Cohen w/Attachment(s)",https://foia.state.gov/DOCUMENTS/FOIA_L_Oct2023/FL-2017-13804/DOC_0C09000034/C09000034.pdf,"State Department FOIA record C09000034, dated 9/25/1995, is titled ""September 25, 1995 letter From Strobe Talbott To Elise Lewis with attachment"". The released text begins: ""Lewis: I am writing in enthusiastic support of Tom Donilon for Council membership. Please take this letter as a genuinely personal endorsement from someone who knows the Council well -- and of someone who, I'm convinced, would make a real contribution to the activities of the CFR for a long time to come.""",pdf
C09000009,3/25/1998,PSG 3/25/98,https://foia.state.gov/DOCUMENTS/FOIA_L_Oct2023/FL-2017-13804/DOC_0C09000009/C09000009.pdf,"State Department FOIA record C09000009, dated 8/31/1995, is titled ""BOSNIA: SECRETARY-KOZYREV LETTER"". Released under FOIA case F-2017-13804 in the Strobe Talbott collection. Searchable text was not extracted; consult the source PDF for full content.",metadata
C09000010,3/25/1998,PSG 3/25/98,https://foia.state.gov/DOCUMENTS/FOIA_L_Oct2023/FL-2017-13804/DOC_0C09000010/C09000010.pdf,"State Department FOIA record C09000010, dated 10/13/1995, is titled ""Memorandum from Strobe Talbott to Ambassador Holbrooke"". Released under FOIA case F-2017-13804 in the Strobe Talbott collection. Searchable text was not extracted; consult the source PDF for full content.",metadata
C09000023,3/25/1998,PSG 3/25/98,https://foia.state.gov/DOCUMENTS/FOIA_L_Sep2023/FL-2017-13804/DOC_0C09000023/C09000023.pdf,"State Department FOIA record C09000023, dated 12/20/1988, is titled ""TALBOTT/SUMMERS/FUERTH MEETING WITH PRIMAKOV"". The released text begins: ""N Addressees outside the Department of State must handle the document in accordance with the above instructions and with current Department of State instructions on NODIS. When this document is no longer needed, the recipient is responsible for supervising its destruction.""",pdf
C09000033,3/25/1998,"March 25, 1998 Letter From Strobe Talbott To Marisa Lino",https://foia.state.gov/DOCUMENTS/FOIA_L_Oct2023/FL-2017-13804/DOC_0C09000033/C09000033.pdf,"State Department FOIA record C09000033, dated 4/14/1995, is titled ""April 14, 1995 Letter From Strobe Talbott To Professor Tucker W/Attachment(s)"". The released text begins: ""These your Op-Ed informative contributions have been informative been given given to to our our Office Office of of Russian Affairs, which is preparing for for the President's President's trip trip to Moscow in May. to May. In your In your letter you mentioned the possibility of of former former Ambassador Kennan attending the Ambassador Kennan the end end of of World War 50th War II 50th anniversary celebration in Mosco…",pdf
C09000117,3/25/1998,"March 25, 1998 Letter From Strobe Talbott To James Rosappe",https://foia.state.gov/DOCUMENTS/FOIA_L_Oct2023/FL-2017-13804/DOC_0C09000117/C09000117.pdf,"State Department FOIA record C09000117, dated 2/6/1997, is titled ""February 6, 1997 Note From Strobe Talbott To Alan Romberg"". Released under FOIA case F-2017-13804 in the Strobe Talbott collection. Searchable text was not extracted; consult the source PDF for full content.",metadata
C09000118,3/25/1998,"March 25, 1998 Letter From Strobe Talbott To John Kornblum",https://foia.state.gov/DOCUMENTS/FOIA_L_Oct2023/FL-2017-13804/DOC_0C09000118/C09000118.pdf,"State Department FOIA record C09000118, dated 2/7/1997, is titled ""February 7, 1997 Letter From Strobe Talbott To Valerie Towns w/Attachment(s)"". The released text begins: ""II am very grateful am very to you grateful to you for the hard for the work and hard work and assistance assistance you you provided. provided. When we return When we Moscow, as to Moscow, rerurn to as we we nono doubt doubt will, will, II hope to see hope to see you you again. again.""",pdf
C09000119,3/25/1998,"March 25, 1998 Letter From Strobe Talbott To Avis Bohlen",https://foia.state.gov/DOCUMENTS/FOIA_L_Oct2023/FL-2017-13804/DOC_0C09000119/C09000119.pdf,"State Department FOIA record C09000119, dated 2/7/1997, is titled ""February 7, 1997 Note From Strobe Talbott To Jim Collins"". The released text begins: ""That means we really need to step up our thinking on what we do now. Naturally, I'm more than passingly curious about what this means for my travel and personal involvement.""",pdf
C09000120,3/25/1998,"March 25, 1998 Letter From Strobe Talbott To Frances Cook",https://foia.state.gov/DOCUMENTS/FOIA_L_Oct2023/FL-2017-13804/DOC_0C09000120/C09000120.pdf,"State Department FOIA record C09000120, dated 1/31/1997, is titled ""January 31, 1997 Letter From To Samuel Berger w/Attached Fax"". The released text begins: ""ODAIO: .___ __ _ __ _ _.,;S::;.;P-=E SPECIAL :..:C~IA..;.:L:...:N :..:.:= O~S NOTES ANDAND INSTRUCTIONS PLEASE PASS THE FOLLOWING LETTER t 'TO DEPUTY SECRETARY TALBOTT ASAt->. Permanent Representative on the Nuu.lt !tabu& Nuidi ALb111Lk: Cuuueil Cut ate Cuuur.:il fut yc.tU' following tltc year lhis summer's Culluwing this summer'r.""",pdf
C09000122,3/25/1998,"March 25, 1998 Letter From Strobe Talbott To Paul Reid",https://foia.state.gov/DOCUMENTS/FOIA_L_Oct2023/FL-2017-13804/DOC_0C09000122/C09000122.pdf,"State Department FOIA record C09000122, dated n/a, is titled ""ST notes on Kissinger piece"". The released text begins: ""We need to refute those one by one, by arguing with as much specifics as possible, that NATO remains NATO - the NAC remains NAC; C; Russia will be in neither, defacto or otherwise. Thefact fact that we are 16+1 consultations activities with willing to carry out institutionalized 16+1 ofNATO's Russia does not undermine, dilute or corrupt the integrity of processes, rights, etc.""",pdf
C09000123,3/25/1998,"March 25, 1998 Letter From Strobe Talbott To Chris Hill",https://foia.state.gov/DOCUMENTS/FOIA_L_Oct2023/FL-2017-13804/DOC_0C09000123/C09000123.pdf,"State Department FOIA record C09000123, dated n/a, is titled ""Note From Strobe Talbott To Amb. Grossman"". The released text begins: ""Grossman -— EUR From Strobe Talbott Marc, I was struck, as I'm sure you were, by the in-your-face .of Dejammet's refusal to go along with us and the Brits in the quality ,of UN on Iraq. Further evidence of how serious the problems are with that relationship.""",pdf
C09000004,3/26/1998,Weekly Report from the Department of State,https://foia.state.gov/DOCUMENTS/FOIA_L_Apr2023/FL-2017-13804/DOC_0C09000004/C09000004.pdf,"State Department FOIA record C09000004, dated 2/13/1996, is titled ""February 13, 1996 Letter From Strobe To Leon Aron"". The released text begins: ""The article from Post-Soviet Affairs is extremely lucid and helpful. I've sent it along to several colleagues, urging them to read it.""",pdf
C09000024,3/26/1998,MEMORANDUM FOR THE FILE w/Attached Facsimile Transmission,https://foia.state.gov/DOCUMENTS/FOIA_L_Feb2024/FL-2017-13804/DOC_0C09000024/C09000024.pdf,"State Department FOIA record C09000024, dated 4/26/1996, is titled ""Handwritten Letter"". The released text begins: ""GORDON SMITH TO: I' , 613-944-0856 TEL: FAX: DEAR GORDON: MANY THANKS FOR YOUR BIRTHDAY MESSAGE: GREETING. I'LL AGE GRACEFULLY IN THIS JOB IF I CAN ARRANGE TO HAVE MORE FRIENDS, COLLEAGUES AND COUNTERPARTS LIKE YOURSELF.""",pdf
C09000116,3/26/1998,Handwritten Note w/Attachment(s),https://foia.state.gov/DOCUMENTS/FOIA_L_Oct2023/FL-2017-13804/DOC_0C09000116/C09000116.pdf,"State Department FOIA record C09000116, dated 2/6/1997, is titled ""February 6, 1997 Note From Strobe Talbott To Dick Sklar w/Attached Facsimile Transmission"". The released text begins: ""C. 20520 Washingwn, D.0 2 0520 OFFICE OF OFFICE OF THE DEPUTY SECRETARY THE DEPUTY SECRETARY Facsimile Transmission Facsimile Transmission Date: Date: 'Pages: __ Pages: :>._ __ D- (incl. It's a powerful document, with lots of ideas that I want to think about hard over the next couple of days.""",pdf
C09000115,3/27/1998,Handwritten Note w/Attachment(s),https://foia.state.gov/DOCUMENTS/FOIA_L_Oct2023/FL-2017-13804/DOC_0C09000115/C09000115.pdf,"State Department FOIA record C09000115, dated 1/26/1997, is titled ""January 26, 1997 Note From Strobe Talbott To Amb. Christopher Hill w/Attachment(s)"". The released text begins: ""Amb, Christopher Christopher Hill Hill -— Embassy Embassy Skopje Skopje Chris: Chris: Attached Attached is is aa note note II sent sent to to Dada Poposki, Poposki, about whom I've about whom I've spoken to to you you before. before. II hope hope this this finds finds you you and and your family family well. weH.""",pdf
C09000112,3/29/1998,"March 29, 1998 Note From Strobe Talbott To Amb. Sestanovich",https://foia.state.gov/DOCUMENTS/FOIA_L_Oct2023/FL-2017-13804/DOC_0C09000112/C09000112.pdf,"State Department FOIA record C09000112, dated 10/14/1997, is titled ""October 14, 1997 Note From Strobe Talbott To SS"". The released text begins: ""P.S.) SS: FYI, Dick Holbrooke is meeting today in Nice (rhymes wi~h grease) with Berezovsky. I asked him to hit (r~Y°:1':~ with ' hard at Iran/missiles, Gazprom, religious law and the prospects for a good summit next year.""",pdf
C09000008,3/30/1998,Kosovo Road Map,https://foia.state.gov/DOCUMENTS/FOIA_L_Oct2023/FL-2017-13804/DOC_0C09000008/C09000008.pdf,"State Department FOIA record C09000008, dated 8/19/1988, is titled ""August 19, 1988 Note From Strobe Talbott To Steve"". The released text begins: ""The hardest part is still to come -— how take the general thesis outlined here and apply it to the agenda and schedule of the Summit itself, and how we apply it to the hard choices we have ahead of us, especially vis-a-vis vis-à-vis Treasu… Wednesday, August 19, 1998, 7 a.m. • What we need: a ""high concept"" paper that puts the objectives of Summjt in the context of our long-term (and long-standing) the Summit strategy toward Russia, and that balanc…",pdf
C09000002,3/31/1998,"March 31, 1998 Note From Strobe Talbott To MKA",https://foia.state.gov/DOCUMENTS/FOIA_L_Jan2024/FL-2017-13804/DOC_0C09000002/C09000002.pdf,"State Department FOIA record C09000002, dated 11/3/1990, is titled ""Handwritten Note w/Attachment(s)"". The released text begins: ""Paul Vd[cker NCll1II AmericanOlellnlM None Mlerican Meitwirl Oft0 Grat ono Graf Lambldot11 Limbach""! Bill Clinton EulopNIIOI.,_ ,, Eurdeein assaren President of the President of United States the United 'lbtwo *Imo Kobaya$hl JlpeneN Kobayasto ~ The White White House aosress Chaffy' Avenue, N.W. 1600 Pennsylvania Avenue, N.W.""",pdf
C09000007,3/31/1998,Kosovo Road Map,https://foia.state.gov/DOCUMENTS/FOIA_L_Oct2023/FL-2017-13804/DOC_0C09000007/C09000007.pdf,"State Department FOIA record C09000007, dated 8/14/1995, is titled ""Finland and European Security"". Released under FOIA case F-2017-13804 in the Strobe Talbott collection. Searchable text was not extracted; consult the source PDF for full content.",metadata
C09000001,4/1/1998,"April 1, 1998 Note From Strobe Talbott To MKA w/Attachment(s)",https://foia.state.gov/DOCUMENTS/FOIA_L_Jan2024/FL-2017-13804/DOC_0C09000001/C09000001.pdf,"State Department FOIA record C09000001, dated 7/16/1993, is titled ""Memon with President Boris Yeltsin of Russia w/Attached Cover Sheet"". The released text begins: ""S. ___A~ jlcnatio_ RETURN TO - RETURN-T4 TO9- STAFF ~ FAsSrSTAN7 NT STAFF ASSISTANT ASSISTANT STAFF ASSISTANT COPY NO. MOSCOW EYES ONLY FOR AMBASSADOR PICKERING.""",pdf
C09000114,4/1/1998,"April 1, 1998 Note From Strobe Talbott To Bill Woodward",https://foia.state.gov/DOCUMENTS/FOIA_L_Oct2023/FL-2017-13804/DOC_0C09000114/C09000114.pdf,"State Department FOIA record C09000114, dated 1/21/1997, is titled ""January 21, 1997 Note From Strobe Talbott To Tim Wirth"". The released text begins: ""Quite the contrary, I really do want on a variety of things, including personnel issues that to get your views 011 relate to the ""G"" bureaus. I tried calling you over the weekend and on Inauguration day, but I know how bow crazy it was in our household, and I suspsect the same was true at yours.""",pdf
C09000125,4/4/1998,"Deputy Secretary's August 4 Meeting with U.S. Ambassador to Cyprus Kenneth Brill, Tuesday, August 4, 10:30 am",https://foia.state.gov/DOCUMENTS/FOIA_L_Oct2023/FL-2017-13804/DOC_0C09000125/C09000125.pdf,"State Department FOIA record C09000125, dated 4/4/1998, is titled ""Deputy Secretary's August 4 Meeting with U.S. Ambassador to Cyprus Kenneth Brill, Tuesday, August 4, 10:30 am"". The released text begins: ""B4CL: JohnR.B ~ 2 ' / Subject: Subject: Deputy Secretary's Deputy Secretary 's August August 44 Meeting Meeting with U.S. Ambassad or to to Cyprus Cyprus Kenneth Brill.""",pdf
C09000048,4/5/1998,"April 5, 1998 Letter From Strobe Talbott To Georgiy Mamedov",https://foia.state.gov/DOCUMENTS/FOIA_L_Dec2023/FL-2017-13804/DOC_0C09000048/C09000048.pdf,"State Department FOIA record C09000048, dated 12/22/1995, is titled ""December 22, 1995 Note from Ken Brill to Acting Secretary"". Released under FOIA case F-2017-13804 in the Strobe Talbott collection. Searchable text was not extracted; consult the source PDF for full content.",metadata
C09000047,4/6/1998,Handwritten Letter w/Attachment(s),https://foia.state.gov/DOCUMENTS/FOIA_L_Mar2023/FL-2017-13804/DOC_0C09000047/C09000047.pdf,"State Department FOIA record C09000047, dated 5/23/1995, is titled ""Summers trip to Moscow and Russian Finance w/Attached Cover Sheet"". The released text begins: ""Addressees outside the Department of State should handle the document in accordance with the above instructions. When this document is no longer needed, the recipient is responsible for seeing that it is is destroyed and for mailing a record of destruction to Mr.""",pdf
C09000113,4/6/1998,Handwritten Note,https://foia.state.gov/DOCUMENTS/FOIA_L_Oct2023/FL-2017-13804/DOC_0C09000113/C09000113.pdf,"State Department FOIA record C09000113, dated 4/6/1998, is titled ""Handwritten Note"". Released under FOIA case F-2017-13804 in the Strobe Talbott collection. Searchable text was not extracted; consult the source PDF for full content.",metadata
C09000006,4/7/1998,"April 7, 1998 Note From Strobe Talbott To Tom Pickering",https://foia.state.gov/DOCUMENTS/FOIA_L_Oct2023/FL-2017-13804/DOC_0C09000006/C09000006.pdf,"State Department FOIA record C09000006, dated 3/22/1996, is titled ""March 22, 1996 Letter From Acting Secretary To Elaine Agnes McGovern"". The released text begins: ""McGovern: l'm writing to convey my regret and apologies for the confusion at the Retirement Ceremony this morning. 0ur reliance on computer lists can and does get us in trouble, as it did today. I did want to congratulate you on a job well done in a series of difficult posts around the world: Belgrade, Pretoria, Rabat, Nairobi, Libreville, New Delhi, Colombo and, fiiially, Vienna.""",pdf
C09000076,4/8/1998,"April 8, 1998 Note From Strobe Talbott To Sandy",https://foia.state.gov/DOCUMENTS/FOIA_L_Sep2022/FL-2017-13804/DOC_0C09000076/C09000076.pdf,"State Department FOIA record C09000076, dated 11/22/1995, is titled ""November 22, 1995 Note from Strobe Talbott to Sandy"". Released under FOIA case F-2017-13804 in the Strobe Talbott collection. Searchable text was not extracted; consult the source PDF for full content.",metadata
C09000110,4/8/1998,"April 8, 1998 Note From Claire To Helen w/Attachment(s)",https://foia.state.gov/DOCUMENTS/FOIA_L_Oct2023/FL-2017-13804/DOC_0C09000110/C09000110.pdf,"State Department FOIA record C09000110, dated 2/9/1997, is titled ""February 9, 1997 Letter From To George F. Kennan w/Attached Facsimile Transmission"". The released text begins: ""I ' '--Lv 1 ' - OCJ4 I ..JOU'+ A-UUUUU712225 A-uuum712225 ""UNCLASSIFIED"" ""UNCLASSIFIED"" [1/4 /2024] Page [1/4/2024] Page352 352 DEPARTMENT OFSTATE DEPARTMENTOF STATE OFFICEOF OFFICE DEPUTYSECRETARY THEDEPUTY OFTHE SECRETARY FocslnlfloTrana… Kennan Institute for Advanced Study [CHECK THAT THIS IS CORRECT NAME OF THE INSTITUTE] Princeton, New Jersey Dear George: I am sorry not to have written more promptly in response…",pdf
C09000067,4/9/1998,Letter to Governor Knowles on Tulsequah Chief Mine w/Attachment(s),https://foia.state.gov/DOCUMENTS/FOIA_L_Dec2023/FL-2017-13804/DOC_0C09000067/C09000067.pdf,"State Department FOIA record C09000067, dated 9/21/1995, is titled ""Facsimile Transmission from Strobe Talbott to Leon Fuerth"". Released under FOIA case F-2017-13804 in the Strobe Talbott collection. Searchable text was not extracted; consult the source PDF for full content.",metadata
C09000069,4/9/1998,Letter to Governor Knowles on Tulsequah Chief Mine w/Attachment(s),https://foia.state.gov/DOCUMENTS/FOIA_L_Dec2023/FL-2017-13804/DOC_0C09000069/C09000069.pdf,"State Department FOIA record C09000069, dated 9/8/1982, is titled ""Public Law 97-255 97th Congress An Act"". The released text begins: ""PUBLIC 97-255--SEPI'. 8, S, 1982 1982 • Public Law 97-255 97th Congress An Act . S. ig BS OUJCtttl by the U enacted Saum and tM Senate HoUM of antl House of Representativa R~pf""Clffllatil,a ofof the 1M =· Flldiml lll&epitJ A.cl ol 1912. 21 USCUUIL United Sa:noK L Secrzose Financial Sr.c. 2.""",pdf
C09000109,4/9/1998,"April 9, 1998 Note From Greg To Strobe Talbott",https://foia.state.gov/DOCUMENTS/FOIA_L_Oct2023/FL-2017-13804/DOC_0C09000109/C09000109.pdf,"State Department FOIA record C09000109, dated 2/10/1997, is titled ""Prep meeting for Albright/Primakov Ministerial NATO-Russia Interagency flying squad 4:30 p.m. February 10, 1997"". The released text begins: """"CFE-plus"" -— counter to Russian insistence on ""ban"" on troops and infrastructure in new member states. (Norway modeI model as analogue to Loda)/ ~ 3 no's for nukes?) -— Bob Bell /Jan Lodal /~ 2.""",pdf
C09000057,4/10/1998,"February 16, 1998 Letter From Strobe Talbott To Taylor w/Attached Facsimile Transmision",https://foia.state.gov/DOCUMENTS/FOIA_L_Jan2023/FL-2017-13804/DOC_0C09000057/C09000057.pdf,"State Department FOIA record C09000057, dated 9/30/1993, is titled ""September 30, 1993 Letter To Tony"". The released text begins: ""I've been concerned over the past little whi.le, certainly going back to the Great Grachev Near-Non-Drop-By, that we really did need to sit down and talk through with each other a couple of issues. But that's not going to be very easy.""",pdf
C09000078,4/10/1998,"April 10, 1998 Note From Strobe Talbott To Sandy",https://foia.state.gov/DOCUMENTS/FOIA_L_Sep2022/FL-2017-13804/DOC_0C09000078/C09000078.pdf,"State Department FOIA record C09000078, dated 4/11/1995, is titled ""U.S. - Turkish Leadership in the post-Cold War World"". The released text begins: ""U.S. -- Turkish Turkish Leadership Leadership in in the the post-Cold post-Cold War War World World (AS (AS DELIVERED) DELIVERED) Remarks Remarks by U.S. Deputy Secretary of State Strobe Talbott at at Bilkent Bilkent University University Ankara, Turkey April 11, 1995 FL-2017-13804 A-00000608870 ""UNCLASSIFIED"" 7/11/2023 FL-2017-13804 7-11-23 2 It's a pleasure to be back in Ankara.""",pdf
C09000077,4/12/1998,"April 12, 1998 Note From Strobe Talbott To Sandy W/Attachment(s)",https://foia.state.gov/DOCUMENTS/FOIA_L_Sep2022/FL-2017-13804/DOC_0C09000077/C09000077.pdf,"State Department FOIA record C09000077, dated 12/14/1995, is titled ""December 24, 1995 Note from Strobe Talbott to Ambassador Frowick"". Released under FOIA case F-2017-13804 in the Strobe Talbott collection. Searchable text was not extracted; consult the source PDF for full content.",metadata
C09000065,4/15/1998,DRAFT THANK YOU LETTERS FOR THE DEPUTY SECRETARY'S MARCH 13-15 VISIT TO OMAN,https://foia.state.gov/DOCUMENTS/FOIA_L_Apr2024/FL-2017-13804/DOC_0C09000065/C09000065.pdf,"State Department FOIA record C09000065, dated 6/25/1995, is titled ""Handwritten Letter w/Attachment(s)"". The released text begins: ""10/10/2023 fI-2017-13804 10-10-2f 401/05 A-00000657513 ""UNCLASSIFIED"" FL-2017-13804 CS FIRST BOSTON cs tint Banco Corporation Facsimile IN 25 MO:49 55 Eait Mad Street New York.. If you have met ive4 this corrimunication in error. the intended recipient or In ernrInycr or agent please notify us irnnirdiattly by telerhotIn arid return the otigPnal ttsponsIbie for deli% enrig the rnesstigt to the irittndut message so…""",pdf
C09000066,4/17/1998,Letter to British Secretary Beckett w/Attached Pouch Transmittal Slip,https://foia.state.gov/DOCUMENTS/FOIA_L_Dec2023/FL-2017-13804/DOC_0C09000066/C09000066.pdf,"State Department FOIA record C09000066, dated 9/7/1995, is titled ""Facsimile Transmission from Strobe Talbott to Sandy Berger"". Released under FOIA case F-2017-13804 in the Strobe Talbott collection. Searchable text was not extracted; consult the source PDF for full content.",metadata
C09000068,4/17/1998,Letter to British Secretary Beckett w/Attachment(s),https://foia.state.gov/DOCUMENTS/FOIA_L_Dec2023/FL-2017-13804/DOC_0C09000068/C09000068.pdf,"State Department FOIA record C09000068, dated 12/14/1995, is titled ""Note from Strobe Talbott to ASSISTANT Secretary Holbrooke"". Released under FOIA case F-2017-13804 in the Strobe Talbott collection. Searchable text was not extracted; consult the source PDF for full content.",metadata
C09000003,4/27/1998,"April 27, 1998 Note From Strobe Talbott To Leon",https://foia.state.gov/DOCUMENTS/FOIA_L_Apr2023/FL-2017-13804/DOC_0C09000003/C09000003.pdf,"State Department FOIA record C09000003, dated 8/5/1995, is titled ""August 5, 1995 Letter From Strobe Talbott To Jaswant"". The released text begins: ""Three generations of our family are gathering, under the of my father (an ornithological pandit and master of leadership of of the wilderness), for an expedition to the Galapagos Islands. Before departing, I wanted to put before you some thoughts about our next meeting.""",pdf
C09000011,4/27/1998,Handwritten Letter,https://foia.state.gov/DOCUMENTS/FOIA_L_Jan2023/FL-2017-13804/DOC_0C09000011/C09000011.pdf,"State Department FOIA record C09000011, dated 7/9/1993, is titled ""Handwritten Notes"". Released under FOIA case F-2017-13804 in the Strobe Talbott collection. Searchable text was not extracted; consult the source PDF for full content.",metadata
C09000108,4/29/1998,"April 29, 1998 Note From Strobe Talbott To Jeremy Rosner",https://foia.state.gov/DOCUMENTS/FOIA_L_Oct2023/FL-2017-13804/DOC_0C09000108/C09000108.pdf,"State Department FOIA record C09000108, dated 2/10/1997, is titled ""CEE Journalists 2/10/97 w/Attachment(s)"". The released text begins: ""Charter -- covering evolution of NATO-R coop 2. Woke ~ • 10, 18, Poland Aaore Apr• Lot LJd.""",pdf
C09000035,4/30/1998,Weekly Report from the Department of State,https://foia.state.gov/DOCUMENTS/FOIA_L_Apr2023/FL-2017-13804/DOC_0C09000035/C09000035.pdf,"State Department FOIA record C09000035, dated 11/28/1995, is titled ""November 28, 1995 Note from Strobe Talbott to Ambassador McNamara"". Released under FOIA case F-2017-13804 in the Strobe Talbott collection. Searchable text was not extracted; consult the source PDF for full content.",metadata
C09000056,4/30/1998,"April 30, 1998 Letter From Yuli M. Vorontsov To Strobe Talbott",https://foia.state.gov/DOCUMENTS/FOIA_L_Oct2023/FL-2017-13804/DOC_0C09000056/C09000056.pdf,"State Department FOIA record C09000056, dated 6/9/1994, is titled ""Letter dated June 9, 1994 from Nelson S. Talbott to Bill Clinton"". The released text begins: ""TM-1KM WW4AM PAWL _OWO AWING June 9. 1994 Dear Mr. President: Weicome home from an outstanding, inspirational performance in Europe.""",pdf
C09000039,5/2/1998,"May 2, 1998 Note From Strobe Talbott To Sandy Berger w/Attachment(s)",https://foia.state.gov/DOCUMENTS/FOIA_L_Apr2023/FL-2017-13804/DOC_0C09000039/C09000039.pdf,"State Department FOIA record C09000039, dated 5/29/1995, is titled ""Handwritten Note W/Attachment(s)"". The released text begins: ""Strobe Talbott Deputy Secretary of 5tate State U.S. Via FAX#202-647-8047 FAX:#202•647-6047 Strobe: Dear Str.obe: lI don't do much (or, in fact. fact, anything) in the way of lobbying for Austria.""",pdf
