document_id,date,title,pdf_url,description,description_source
C09000022,12/21/1998,"December 21, 1998 Letter From Philip S. Goldberg To Edward Lucas w/Attachment(s)",https://foia.state.gov/DOCUMENTS/FOIA_L_Dec2023/FL-2017-13804/DOC_0C09000022/C09000022.pdf,"State Department FOIA record C09000022, dated 3/28/1994, is titled ""WHOSE RUSSIA IS IT ANYWAY? TOWARD A POLICY OF BENIGN RESPECT"". The released text begins: ""CONEID, 03/28 03/28/94 pm 06:37 pm Page: Page: 1 1 Item Subject: Item Subject: WHOSE RUSSIA IS IS IT IT ANYWAY? TOwARD POLICY OF or BENIGN BENIGN RESPECT RESPECT PAGE 01 PAGE 01 MOSCOW MOSCOW 8427 8427 281232Z MAR 94 2812322 SUBJECT: SUBJECT: WHOSE RUSSIA WHOSE RUSSIA IS IS I'£ IT ANYWAY?""",pdf
C09000022,12/21/1998,"December 21, 1998 Note From To Sandy Berger w/Attachment(s)",https://foia.state.gov/DOCUMENTS/FOIA_L_Mar2025/FL-2017-13804/DOC_0C09000022/C09000022.pdf,"State Department FOIA record C09000022, dated 3/28/1994, is titled ""WHOSE RUSSIA IS IT ANYWAY? TOWARD A POLICY OF BENIGN RESPECT"". The released text begins: ""CONEID, 03/28 03/28/94 pm 06:37 pm Page: Page: 1 1 Item Subject: Item Subject: WHOSE RUSSIA IS IS IT IT ANYWAY? TOwARD POLICY OF or BENIGN BENIGN RESPECT RESPECT PAGE 01 PAGE 01 MOSCOW MOSCOW 8427 8427 281232Z MAR 94 2812322 SUBJECT: SUBJECT: WHOSE RUSSIA WHOSE RUSSIA IS IS I'£ IT ANYWAY?""",pdf
C09000026,12/21/1998,"December 21, 1998 Letter From To Yuri",https://foia.state.gov/DOCUMENTS/FOIA_L_Mar2025/FL-2017-13804/DOC_0C09000026/C09000026.pdf,"State Department FOIA record C09000026, dated 4/22/1995, is titled ""April 22, 1995 Memorandum from Strobe Talbott to THE SECRETARY"". Released under FOIA case F-2017-13804 in the Strobe Talbott collection. Searchable text was not extracted; consult the source PDF for full content.",metadata
C09000050,12/21/1998,"December 21, 1998 Letter From Strobe Talbott To Bronislaw Geremek",https://foia.state.gov/DOCUMENTS/FOIA_L_Dec2023/FL-2017-13804/DOC_0C09000050/C09000050.pdf,"State Department FOIA record C09000050, dated 12/10/1995, is titled ""Handwritten Letter"". The released text begins: ""(i ~ ~ ic./ ~kjl A irj t>-- f""— fi-alliVer yv c. if- ::z,,.,/ 't-t ;._. ss ~ ,.""",pdf
C09000048,12/22/1998,"December 22, 1998 Letter From Strobe Talbott To Gene Roberts w/Attachment(s)",https://foia.state.gov/DOCUMENTS/FOIA_L_Jan2023/FL-2017-13804/DOC_0C09000048/C09000048.pdf,"State Department FOIA record C09000048, dated 12/22/1995, is titled ""December 22, 1995 Note from Ken Brill to Acting Secretary"". Released under FOIA case F-2017-13804 in the Strobe Talbott collection. Searchable text was not extracted; consult the source PDF for full content.",metadata
C09000053,12/22/1998,"December 22, 1998 Note From Strobe Talbott To Sandy",https://foia.state.gov/DOCUMENTS/FOIA_L_Dec2023/FL-2017-13804/DOC_0C09000053/C09000053.pdf,"State Department FOIA record C09000053, dated 5/4/1994, is titled ""Opening comments about last night's CNN"". The released text begins: ""BC asks about Karen Elliot House ST: She's a neocon, wife of Kahn, beaten up alot of us over years, close to WSJ editorial line. Not a classic right-winger , but hard line.""",pdf
C09000049,12/23/1998,"December 23, 1998 Letter From Strobe Talbott To Louis J. Freeh w/Attachment(s)",https://foia.state.gov/DOCUMENTS/FOIA_L_Jan2023/FL-2017-13804/DOC_0C09000049/C09000049.pdf,"State Department FOIA record C09000049, dated 12/22/1995, is titled ""December 22, 1995 Note from Deputy Secretary to Nick Rasmussen"". Released under FOIA case F-2017-13804 in the Strobe Talbott collection. Searchable text was not extracted; consult the source PDF for full content.",metadata
C09000005,12/28/1998,"December 28, 1998 Letter From Strobe Talbott To Jaswant Singh w/Attached Fax Cover Sheet",https://foia.state.gov/DOCUMENTS/FOIA_L_Dec2023/FL-2017-13804/DOC_0C09000005/C09000005.pdf,"State Department FOIA record C09000005, dated 10/14/1995, is titled ""October 14, 1995 Note from Strobe Talbott to Chris"". Released under FOIA case F-2017-13804 in the Strobe Talbott collection. Searchable text was not extracted; consult the source PDF for full content.",metadata
C09000006,12/28/1998,"December 28, 1998 Letter From Strobe Talbott To Jaswant Singh",https://foia.state.gov/DOCUMENTS/FOIA_L_July2023/FL-2017-13804/DOC_0C09000006/C09000006.pdf,"State Department FOIA record C09000006, dated 3/22/1996, is titled ""March 22, 1996 Letter From Acting Secretary To Elaine Agnes McGovern"". The released text begins: ""McGovern: l'm writing to convey my regret and apologies for the confusion at the Retirement Ceremony this morning. 0ur reliance on computer lists can and does get us in trouble, as it did today. I did want to congratulate you on a job well done in a series of difficult posts around the world: Belgrade, Pretoria, Rabat, Nairobi, Libreville, New Delhi, Colombo and, fiiially, Vienna.""",pdf
C09000009,12/31/1998,SECI at Age 2,https://foia.state.gov/DOCUMENTS/FOIA_L_Jan2024/FL-2017-13804/DOC_0C09000009/C09000009.pdf,"State Department FOIA record C09000009, dated 8/31/1995, is titled ""BOSNIA: SECRETARY-KOZYREV LETTER"". Released under FOIA case F-2017-13804 in the Strobe Talbott collection. Searchable text was not extracted; consult the source PDF for full content.",metadata
C09000015,1/6/1999,Moving Forward on Kosovo,https://foia.state.gov/DOCUMENTS/FOIA_L_July2023/FL-2017-13804/DOC_0C09000015/C09000015.pdf,"State Department FOIA record C09000015, dated 11/8/1995, is titled ""NATIONALISM FOR REALISTS: RUSSIAN SECURITY EXPERTS SEEK TO COMBINE REFORM AND REASSERTION"". Released under FOIA case F-2017-13804 in the Strobe Talbott collection. Searchable text was not extracted; consult the source PDF for full content.",metadata
C09000014,1/8/1999,Zbig ' s Summit Fears w/Attachment(s),https://foia.state.gov/DOCUMENTS/FOIA_L_July2023/FL-2017-13804/DOC_0C09000014/C09000014.pdf,"State Department FOIA record C09000014, dated 2/8/1996, is titled ""Handwritten Letter"". Released under FOIA case F-2017-13804 in the Strobe Talbott collection. Searchable text was not extracted; consult the source PDF for full content.",metadata
C09000016,1/13/1999,NOTE TO THE SECRETARY w/Attachment(s),https://foia.state.gov/DOCUMENTS/FOIA_L_July2023/FL-2017-13804/DOC_0C09000016/C09000016.pdf,"State Department FOIA record C09000016, dated 11/8/1995, is titled ""SEARCHING FOR RUSSIA'S ""NEW DEFENSE DOCTRINE"""". Released under FOIA case F-2017-13804 in the Strobe Talbott collection. Searchable text was not extracted; consult the source PDF for full content.",metadata
C09000015,1/14/1999,Aide-memoire: First Deputy PM Maslyukov and DepSec Summers 14 January 1999,https://foia.state.gov/DOCUMENTS/FOIA_L_Oct2024/FL-2017-13804/DOC_0C09000015/C09000015.pdf,"State Department FOIA record C09000015, dated 11/8/1995, is titled ""NATIONALISM FOR REALISTS: RUSSIAN SECURITY EXPERTS SEEK TO COMBINE REFORM AND REASSERTION"". Released under FOIA case F-2017-13804 in the Strobe Talbott collection. Searchable text was not extracted; consult the source PDF for full content.",metadata
C09000039,1/14/1999,Our Balkan team and structure,https://foia.state.gov/DOCUMENTS/FOIA_L_Sep2023/FL-2017-13804/DOC_0C09000039/C09000039.pdf,"State Department FOIA record C09000039, dated 5/29/1995, is titled ""Handwritten Note W/Attachment(s)"". The released text begins: ""Strobe Talbott Deputy Secretary of 5tate State U.S. Via FAX#202-647-8047 FAX:#202•647-6047 Strobe: Dear Str.obe: lI don't do much (or, in fact. fact, anything) in the way of lobbying for Austria.""",pdf
C09000042,1/14/1999,"January 14, 1999 Note From Strobe Talbott To Sandy",https://foia.state.gov/DOCUMENTS/FOIA_L_Sep2023/FL-2017-13804/DOC_0C09000042/C09000042.pdf,"State Department FOIA record C09000042, dated 5/25/1995, is titled ""May 25, 1995 Letter From Strobe Talbott To Charles"". The released text begins: ""It is is useful useful and welcome. welcome. You understand You unders what's happening what's in Hungary happening in Hungary better better than than just just about about anyone on anyone on earth, earth, so so II appreciate appreciate your your insights and advice.""",pdf
C09000035,1/21/1999,"January 21, 1999 Note From Strobe Talbott To MKA",https://foia.state.gov/DOCUMENTS/FOIA_L_Sep2023/FL-2017-13804/DOC_0C09000035/C09000035.pdf,"State Department FOIA record C09000035, dated 11/28/1995, is titled ""November 28, 1995 Note from Strobe Talbott to Ambassador McNamara"". Released under FOIA case F-2017-13804 in the Strobe Talbott collection. Searchable text was not extracted; consult the source PDF for full content.",metadata
C09000041,1/21/1999,The Crooked Timber Of Russian Politics w/Attached Wash Fax Receipt,https://foia.state.gov/DOCUMENTS/FOIA_L_Sep2023/FL-2017-13804/DOC_0C09000041/C09000041.pdf,"State Department FOIA record C09000041, dated 7/31/1995, is titled ""Strobe Talbott Travels"". Released under FOIA case F-2017-13804 in the Strobe Talbott collection. Searchable text was not extracted; consult the source PDF for full content.",metadata
C09000045,3/1/1999,"March 1, 1999 Note From Strobe Talbott To Carlos Pascual, NSC w/Attachment(s)",https://foia.state.gov/DOCUMENTS/FOIA_L_Sep2023/FL-2017-13804/DOC_0C09000045/C09000045.pdf,"State Department FOIA record C09000045, dated 6/27/1995, is titled ""Security clearance update for Mr Steven Pifer"". The released text begins: ""Vleaae indicate the date rhAr Hr. Mr Pi Mr Pifer worked for Mr.""",pdf
C09000046,3/1/1999,"March 1, 1999 Note From Strobe Talbott To Phil Gordon, NSC w/Attachment(s)",https://foia.state.gov/DOCUMENTS/FOIA_L_Sep2023/FL-2017-13804/DOC_0C09000046/C09000046.pdf,"State Department FOIA record C09000046, dated 6/28/1995, is titled ""Strobe Talbott's answer to questions re: Mr. Pifer's security update"". Released under FOIA case F-2017-13804 in the Strobe Talbott collection. Searchable text was not extracted; consult the source PDF for full content.",metadata
C09000038,3/8/1999,Special Advisor for Kosovo and Dayton Implementation,https://foia.state.gov/DOCUMENTS/FOIA_L_Sep2023/FL-2017-13804/DOC_0C09000038/C09000038.pdf,"State Department FOIA record C09000038, dated 5/12/1995, is titled ""Handwritten Note"". Released under FOIA case F-2017-13804 in the Strobe Talbott collection. Searchable text was not extracted; consult the source PDF for full content.",metadata
C09000024,3/9/1999,SECRETARY'S MARCH 8 CONVERSATION WITH RUSSIAN FM IVANOV,https://foia.state.gov/DOCUMENTS/FOIA_L_Mar2025/FL-2017-13804/DOC_0C09000024/C09000024.pdf,"State Department FOIA record C09000024, dated 4/26/1996, is titled ""Handwritten Letter"". The released text begins: ""GORDON SMITH TO: I' , 613-944-0856 TEL: FAX: DEAR GORDON: MANY THANKS FOR YOUR BIRTHDAY MESSAGE: GREETING. I'LL AGE GRACEFULLY IN THIS JOB IF I CAN ARRANGE TO HAVE MORE FRIENDS, COLLEAGUES AND COUNTERPARTS LIKE YOURSELF.""",pdf
C09000047,3/14/1999,"March 14, 1999 Note From Strobe Talbott To Leon w/Attached Activity Report",https://foia.state.gov/DOCUMENTS/FOIA_L_Sep2023/FL-2017-13804/DOC_0C09000047/C09000047.pdf,"State Department FOIA record C09000047, dated 5/23/1995, is titled ""Summers trip to Moscow and Russian Finance w/Attached Cover Sheet"". The released text begins: ""Addressees outside the Department of State should handle the document in accordance with the above instructions. When this document is no longer needed, the recipient is responsible for seeing that it is is destroyed and for mailing a record of destruction to Mr.""",pdf
C09000033,3/22/1999,Recommendations for Relocating the Independent Offices/Staffs in the S Area w/Attachment(s),https://foia.state.gov/DOCUMENTS/FOIA_L_Sep2023/FL-2017-13804/DOC_0C09000033/C09000033.pdf,"State Department FOIA record C09000033, dated 4/14/1995, is titled ""April 14, 1995 Letter From Strobe Talbott To Professor Tucker W/Attachment(s)"". The released text begins: ""These your Op-Ed informative contributions have been informative been given given to to our our Office Office of of Russian Affairs, which is preparing for for the President's President's trip trip to Moscow in May. to May. In your In your letter you mentioned the possibility of of former former Ambassador Kennan attending the Ambassador Kennan the end end of of World War 50th War II 50th anniversary celebration in Mosco…",pdf
C09000049,3/28/1999,"March 28, 1999 Letter From Strobe Talbott To Yuri",https://foia.state.gov/DOCUMENTS/FOIA_L_Dec2023/FL-2017-13804/DOC_0C09000049/C09000049.pdf,"State Department FOIA record C09000049, dated 12/22/1995, is titled ""December 22, 1995 Note from Deputy Secretary to Nick Rasmussen"". Released under FOIA case F-2017-13804 in the Strobe Talbott collection. Searchable text was not extracted; consult the source PDF for full content.",metadata
C09000048,3/31/1999,"March 31, 1999 Handwritten Note From Strobe Talbott To Sandy w/Attachment(s)",https://foia.state.gov/DOCUMENTS/FOIA_L_Sep2023/FL-2017-13804/DOC_0C09000048/C09000048.pdf,"State Department FOIA record C09000048, dated 12/22/1995, is titled ""December 22, 1995 Note from Ken Brill to Acting Secretary"". Released under FOIA case F-2017-13804 in the Strobe Talbott collection. Searchable text was not extracted; consult the source PDF for full content.",metadata
C09000041,4/10/1999,Assessment of Primakov's Televised Address to the Nation,https://foia.state.gov/DOCUMENTS/FOIA_L_June2024/FL-2017-13804/DOC_0C09000041/C09000041.pdf,"State Department FOIA record C09000041, dated 7/31/1995, is titled ""Strobe Talbott Travels"". Released under FOIA case F-2017-13804 in the Strobe Talbott collection. Searchable text was not extracted; consult the source PDF for full content.",metadata
C09000040,4/11/1999,MESSAGE TO PRESIDENT YELTSIN REGARDING THE SITUATION IN KOSOVO,https://foia.state.gov/DOCUMENTS/FOIA_L_June2024/FL-2017-13804/DOC_0C09000040/C09000040.pdf,"State Department FOIA record C09000040, dated 6/16/1995, is titled ""June 16, 1995 Letter From Strobe Talbott To Jim W/Attachment(s)"". The released text begins: ""STROBE TALBOTT 0 4 WASHINGTON, DC ti WASHINGTON, 1996 J une 16, June 16, 1995 1995 .2 1 DepSeC (11- Ilas Soo Dear Jim: Dear Jim: . II received receive d your your fax fax yesterday. yesterd ay .""",pdf
C09000009,4/12/1999,"HUMANITARIAN UPDATE NUMBER 13 Kosovo TASK FORCE 0930 EDT Monday, April 12, 1999",https://foia.state.gov/DOCUMENTS/FOIA_L_June2024/FL-2017-13804/DOC_0C09000009/C09000009.pdf,"State Department FOIA record C09000009, dated 8/31/1995, is titled ""BOSNIA: SECRETARY-KOZYREV LETTER"". Released under FOIA case F-2017-13804 in the Strobe Talbott collection. Searchable text was not extracted; consult the source PDF for full content.",metadata
C09000010,4/12/1999,"Your Participation in the Deputies' Committee Meeting on Kosovo, April 12, 1999, from 9:00 to 10:30 a.m., White House Situation Room.",https://foia.state.gov/DOCUMENTS/FOIA_L_June2024/FL-2017-13804/DOC_0C09000010/C09000010.pdf,"State Department FOIA record C09000010, dated 10/13/1995, is titled ""Memorandum from Strobe Talbott to Ambassador Holbrooke"". Released under FOIA case F-2017-13804 in the Strobe Talbott collection. Searchable text was not extracted; consult the source PDF for full content.",metadata
C09000039,4/12/1999,MILOSEVIC SEEKING PRIVATE RUSSIAN INTERMEDIARY?,https://foia.state.gov/DOCUMENTS/FOIA_L_June2024/FL-2017-13804/DOC_0C09000039/C09000039.pdf,"State Department FOIA record C09000039, dated 5/29/1995, is titled ""Handwritten Note W/Attachment(s)"". The released text begins: ""Strobe Talbott Deputy Secretary of 5tate State U.S. Via FAX#202-647-8047 FAX:#202•647-6047 Strobe: Dear Str.obe: lI don't do much (or, in fact. fact, anything) in the way of lobbying for Austria.""",pdf
C09000042,4/13/1999,"Under Secretary Pickering's Meeting with Russian Deputy Foreign Minister Georgiy Mamedov, April 9, 1999, Dresden, Germany w/Attachment(s)",https://foia.state.gov/DOCUMENTS/FOIA_L_June2024/FL-2017-13804/DOC_0C09000042/C09000042.pdf,"State Department FOIA record C09000042, dated 5/25/1995, is titled ""May 25, 1995 Letter From Strobe Talbott To Charles"". The released text begins: ""It is is useful useful and welcome. welcome. You understand You unders what's happening what's in Hungary happening in Hungary better better than than just just about about anyone on anyone on earth, earth, so so II appreciate appreciate your your insights and advice.""",pdf
C09000003,4/19/1999,"Checklist of Key Issues Foreign Policy Team Meeting witch The President, Monday, April 19, 1999 w/Attached Distribution List",https://foia.state.gov/DOCUMENTS/FOIA_L_June2024/FL-2017-13804/DOC_0C09000003/C09000003.pdf,"State Department FOIA record C09000003, dated 8/5/1995, is titled ""August 5, 1995 Letter From Strobe Talbott To Jaswant"". The released text begins: ""Three generations of our family are gathering, under the of my father (an ornithological pandit and master of leadership of of the wilderness), for an expedition to the Galapagos Islands. Before departing, I wanted to put before you some thoughts about our next meeting.""",pdf
C09000004,4/19/1999,"Your meeting with the President's foreign policy team on Kosovo, April 19, 1999, from 1:00 to 2:30 p.m., White House Situation Room.",https://foia.state.gov/DOCUMENTS/FOIA_L_June2024/FL-2017-13804/DOC_0C09000004/C09000004.pdf,"State Department FOIA record C09000004, dated 2/13/1996, is titled ""February 13, 1996 Letter From Strobe To Leon Aron"". The released text begins: ""The article from Post-Soviet Affairs is extremely lucid and helpful. I've sent it along to several colleagues, urging them to read it.""",pdf
C09000030,4/19/1999,TSOHATZOPOULOS SEEKS VIEWS ON POSSIBLE BELGRADE VISIT,https://foia.state.gov/DOCUMENTS/FOIA_L_June2024/FL-2017-13804/DOC_0C09000030/C09000030.pdf,"State Department FOIA record C09000030, dated 6/16/1995, is titled ""June 16, 1995 Letter from Strobe Talbott to Chris"". Released under FOIA case F-2017-13804 in the Strobe Talbott collection. Searchable text was not extracted; consult the source PDF for full content.",metadata
C09000031,4/20/1999,Some Thoughts about Slobodan Milosevic w/Attachment(s),https://foia.state.gov/DOCUMENTS/FOIA_L_June2024/FL-2017-13804/DOC_0C09000031/C09000031.pdf,"State Department FOIA record C09000031, dated 4/12/1995, is titled ""Handwritten Letter W/Attachment(s)"". The released text begins: ""William J • Perry, p erry , Secreta ry of Secretary of Defense. THE THE DEPUTY DEPUTY SECRETARY SECRETAR Y OF OF STATE STATE WASHINGT ON WASHINGTON fJpr Y/ I 1- 7.f' p ~ —31A --;J;vl — - 1 1 /I',.,, i..,>f~J is--1 1"" i.,:aty,A) 'l'---j w-, t._ ,..J (C-<n-rr,_.1 j (..""",pdf
C09000029,4/22/1999,Meeting with NATO Secretary General Javier Solana,https://foia.state.gov/DOCUMENTS/FOIA_L_June2024/FL-2017-13804/DOC_0C09000029/C09000029.pdf,"State Department FOIA record C09000029, dated 6/8/1995, is titled ""Daily Activity Report"". Released under FOIA case F-2017-13804 in the Strobe Talbott collection. Searchable text was not extracted; consult the source PDF for full content.",metadata
C09000017,4/23/1999,"April 23, 1999 Note From Strobe Talbott To MKA",https://foia.state.gov/DOCUMENTS/FOIA_L_July2023/FL-2017-13804/DOC_0C09000017/C09000017.pdf,"State Department FOIA record C09000017, dated 11/13/1995, is titled ""November 13, 1995 Note from Strobe Talbott to Mrs. Gati"". Released under FOIA case F-2017-13804 in the Strobe Talbott collection. Searchable text was not extracted; consult the source PDF for full content.",metadata
C09000024,4/27/1999,AMBASSADOR'S SCHEDULE w/Attached Cover Sheet,https://foia.state.gov/DOCUMENTS/FOIA_L_June2024/FL-2017-13804/DOC_0C09000024/C09000024.pdf,"State Department FOIA record C09000024, dated 4/26/1996, is titled ""Handwritten Letter"". The released text begins: ""GORDON SMITH TO: I' , 613-944-0856 TEL: FAX: DEAR GORDON: MANY THANKS FOR YOUR BIRTHDAY MESSAGE: GREETING. I'LL AGE GRACEFULLY IN THIS JOB IF I CAN ARRANGE TO HAVE MORE FRIENDS, COLLEAGUES AND COUNTERPARTS LIKE YOURSELF.""",pdf
C09000026,4/27/1999,"April 27, 1999 Memorandum From Strobe Talbott To Sec. Albright, APNSA Berger, OVP Fuerth",https://foia.state.gov/DOCUMENTS/FOIA_L_June2024/FL-2017-13804/DOC_0C09000026/C09000026.pdf,"State Department FOIA record C09000026, dated 4/22/1995, is titled ""April 22, 1995 Memorandum from Strobe Talbott to THE SECRETARY"". Released under FOIA case F-2017-13804 in the Strobe Talbott collection. Searchable text was not extracted; consult the source PDF for full content.",metadata
C09000020,4/28/1999,RECOMMENDED NEXT STEPS ON RUSSIA/KOSOVO DIPLOMACY,https://foia.state.gov/DOCUMENTS/FOIA_L_June2024/FL-2017-13804/DOC_0C09000020/C09000020.pdf,"State Department FOIA record C09000020, dated 11/30/1995, is titled ""November 30, 1995 fax from Ambassador Pickering to Toria Nuland and Strobe Talbott with attachments"". Released under FOIA case F-2017-13804 in the Strobe Talbott collection. Searchable text was not extracted; consult the source PDF for full content.",metadata
C09000005,4/29/1999,"Points for Quint Call, April 29, 1999 Chernomyrdin Meeting and Trip w/Attached Distribution List",https://foia.state.gov/DOCUMENTS/FOIA_L_June2024/FL-2017-13804/DOC_0C09000005/C09000005.pdf,"State Department FOIA record C09000005, dated 10/14/1995, is titled ""October 14, 1995 Note from Strobe Talbott to Chris"". Released under FOIA case F-2017-13804 in the Strobe Talbott collection. Searchable text was not extracted; consult the source PDF for full content.",metadata
C09000016,4/29/1999,MEMORANDUM OF TELEPHONE CONVERSATION,https://foia.state.gov/DOCUMENTS/FOIA_L_June2024/FL-2017-13804/DOC_0C09000016/C09000016.pdf,"State Department FOIA record C09000016, dated 11/8/1995, is titled ""SEARCHING FOR RUSSIA'S ""NEW DEFENSE DOCTRINE"""". Released under FOIA case F-2017-13804 in the Strobe Talbott collection. Searchable text was not extracted; consult the source PDF for full content.",metadata
C09000017,4/29/1999,NAC INTERVENTION 4/29/99,https://foia.state.gov/DOCUMENTS/FOIA_L_June2024/FL-2017-13804/DOC_0C09000017/C09000017.pdf,"State Department FOIA record C09000017, dated 11/13/1995, is titled ""November 13, 1995 Note from Strobe Talbott to Mrs. Gati"". Released under FOIA case F-2017-13804 in the Strobe Talbott collection. Searchable text was not extracted; consult the source PDF for full content.",metadata
C09000018,4/29/1999,"April 29, 1999 Memorandum From Strobe Talbott To Secretary Albright",https://foia.state.gov/DOCUMENTS/FOIA_L_June2024/FL-2017-13804/DOC_0C09000018/C09000018.pdf,"State Department FOIA record C09000018, dated 9/18/1996, is titled ""September 18, 1996 Note From Strobe Talbott To SANDY BERGER W/Attachment(s)"". The released text begins: ""A-00000509060 ""UNCLASSIFIED"" 5/18/2022 FL-2017-13804 5-18-22 5-18-2267 FL-2017-13804 United States Department of State The Deputy Secretary Secretary of of State Washington, D.C. 20520 September 18, 1996 .. .. NOTE TO T0 NSC - SANDY BERGER Sandy, As I said on the phone, I think we're with striking distance of an acceptable approach to our Latin American arrns arms transfer policy.""",pdf
C09000019,4/29/1999,UPDATE FROM STROBE,https://foia.state.gov/DOCUMENTS/FOIA_L_June2024/FL-2017-13804/DOC_0C09000019/C09000019.pdf,"State Department FOIA record C09000019, dated 11/28/1995, is titled ""November 28, 1995 Note from Strobe Talbott to Alan Romberg"". Released under FOIA case F-2017-13804 in the Strobe Talbott collection. Searchable text was not extracted; consult the source PDF for full content.",metadata
C09000006,4/30/1999,OFFICIAL INFORMAL - MY APRIL 30 MEETING WITH DFM MAMEDOV ON KOSOVO,https://foia.state.gov/DOCUMENTS/FOIA_L_June2024/FL-2017-13804/DOC_0C09000006/C09000006.pdf,"State Department FOIA record C09000006, dated 3/22/1996, is titled ""March 22, 1996 Letter From Acting Secretary To Elaine Agnes McGovern"". The released text begins: ""McGovern: l'm writing to convey my regret and apologies for the confusion at the Retirement Ceremony this morning. 0ur reliance on computer lists can and does get us in trouble, as it did today. I did want to congratulate you on a job well done in a series of difficult posts around the world: Belgrade, Pretoria, Rabat, Nairobi, Libreville, New Delhi, Colombo and, fiiially, Vienna.""",pdf
C09000011,4/30/1999,DISCUSSION WITH FCO POLITICAL DIRECTOR ON KOSOVO,https://foia.state.gov/DOCUMENTS/FOIA_L_June2024/FL-2017-13804/DOC_0C09000011/C09000011.pdf,"State Department FOIA record C09000011, dated 7/9/1993, is titled ""Handwritten Notes"". Released under FOIA case F-2017-13804 in the Strobe Talbott collection. Searchable text was not extracted; consult the source PDF for full content.",metadata
C09000012,4/30/1999,READ-OUT OF APRIL 29-30 MOSCOW MEETINGS WITH CANADIAN AND GREEK FOREIGN MINISTERS,https://foia.state.gov/DOCUMENTS/FOIA_L_June2024/FL-2017-13804/DOC_0C09000012/C09000012.pdf,"State Department FOIA record C09000012, dated 9/12/1994, is titled ""September 12, 1994 Letter To Boris"". The released text begins: ""II agree agree with with you thatthat we should work we.. should work with with our our P-5 P- colleagues to colleagues to give give impulse impulse toto a a ban ban onon production production of of weapon-grade weapon-grade fissile materi… The fissile The efforts efforts to to develop develop aa ban ban in in the the Conference Conference on Disarmament on Disarmament (CD) (CD) have have thus thus far far been been slow, slow, and and P-5 P-5 action action could…",pdf
C09000014,4/30/1999,THE KOFI SYNDROME AND THE MATRYOSHKA DOLL,https://foia.state.gov/DOCUMENTS/FOIA_L_June2024/FL-2017-13804/DOC_0C09000014/C09000014.pdf,"State Department FOIA record C09000014, dated 2/8/1996, is titled ""Handwritten Letter"". Released under FOIA case F-2017-13804 in the Strobe Talbott collection. Searchable text was not extracted; consult the source PDF for full content.",metadata
