document_id,date,title,pdf_url,description,description_source
C09000040,4/17/1997,SA-10 DEMARCHE: CHUBAYS AND MAMEDOV w/Attached Cover Sheet,https://foia.state.gov/DOCUMENTS/FOIA_L_Oct2024/FL-2017-13804/DOC_0C09000040/C09000040.pdf,"State Department FOIA record C09000040, dated 6/16/1995, is titled ""June 16, 1995 Letter From Strobe Talbott To Jim W/Attachment(s)"". The released text begins: ""STROBE TALBOTT 0 4 WASHINGTON, DC ti WASHINGTON, 1996 J une 16, June 16, 1995 1995 .2 1 DepSeC (11- Ilas Soo Dear Jim: Dear Jim: . II received receive d your your fax fax yesterday. yesterd ay .""",pdf
C09000042,4/17/1997,"April 17, 2017 Note From John Bass To Strobe Talbott",https://foia.state.gov/DOCUMENTS/FOIA_L_July2024/FL-2017-13804/DOC_0C09000042/C09000042.pdf,"State Department FOIA record C09000042, dated 5/25/1995, is titled ""May 25, 1995 Letter From Strobe Talbott To Charles"". The released text begins: ""It is is useful useful and welcome. welcome. You understand You unders what's happening what's in Hungary happening in Hungary better better than than just just about about anyone on anyone on earth, earth, so so II appreciate appreciate your your insights and advice.""",pdf
C09000040,5/8/1997,LETTER FROM THE DEPUTY SECRETARY TO DPM MAMEDOV,https://foia.state.gov/DOCUMENTS/FOIA_L_Mar2023/FL-2017-13804/DOC_0C09000040/C09000040.pdf,"State Department FOIA record C09000040, dated 6/16/1995, is titled ""June 16, 1995 Letter From Strobe Talbott To Jim W/Attachment(s)"". The released text begins: ""STROBE TALBOTT 0 4 WASHINGTON, DC ti WASHINGTON, 1996 J une 16, June 16, 1995 1995 .2 1 DepSeC (11- Ilas Soo Dear Jim: Dear Jim: . II received receive d your your fax fax yesterday. yesterd ay .""",pdf
C09000027,5/11/1997,"May 11, 1997 Note From Strobe Talbott To Ambs. Collins and Presel",https://foia.state.gov/DOCUMENTS/FOIA_L_Feb2024/FL-2017-13804/DOC_0C09000027/C09000027.pdf,"State Department FOIA record C09000027, dated 5/30/1995, is titled ""Daily Activity Report"". Released under FOIA case F-2017-13804 in the Strobe Talbott collection. Searchable text was not extracted; consult the source PDF for full content.",metadata
C09000039,5/11/1997,"May 11, 1997 Letter To Yury",https://foia.state.gov/DOCUMENTS/FOIA_L_Mar2023/FL-2017-13804/DOC_0C09000039/C09000039.pdf,"State Department FOIA record C09000039, dated 5/29/1995, is titled ""Handwritten Note W/Attachment(s)"". The released text begins: ""Strobe Talbott Deputy Secretary of 5tate State U.S. Via FAX#202-647-8047 FAX:#202•647-6047 Strobe: Dear Str.obe: lI don't do much (or, in fact. fact, anything) in the way of lobbying for Austria.""",pdf
C09000059,5/12/1997,"May 12, 1997 Note From Strobe Talbott To John Herbst",https://foia.state.gov/DOCUMENTS/FOIA_L_Feb2024/FL-2017-13804/DOC_0C09000059/C09000059.pdf,"State Department FOIA record C09000059, dated 10/19/1996, is titled ""October 19, 1996 Letter From George To Strobe Talbott"". The released text begins: ""In accordance with rather trustworthy information, there is an agreement signed by US Assistant Secretary of Defense and Deputy Chief of Staff of the Turkish Army to modify Turkish F-16 aircrafts in order to give them nuclear weapons deliv… Specifically, it concerns a special certification of the above-mentioned aircrafts and the possibility of their deployment with nuclear equipment.""",pdf
C09000060,5/13/1997,"May 13, 1997 Note From Strobe Talbott To Jeff Davidow",https://foia.state.gov/DOCUMENTS/FOIA_L_Feb2024/FL-2017-13804/DOC_0C09000060/C09000060.pdf,"State Department FOIA record C09000060, dated 11/21/1995, is titled ""November 21, 1995 Letter from Strobe to Chris and Dick with attachments"". Released under FOIA case F-2017-13804 in the Strobe Talbott collection. Searchable text was not extracted; consult the source PDF for full content.",metadata
C09000010,5/14/1997,NATO-Russia Founding Act Pts,https://foia.state.gov/DOCUMENTS/FOIA_L_Mar2025/FL-2017-13804/DOC_0C09000010/C09000010.pdf,"State Department FOIA record C09000010, dated 10/13/1995, is titled ""Memorandum from Strobe Talbott to Ambassador Holbrooke"". Released under FOIA case F-2017-13804 in the Strobe Talbott collection. Searchable text was not extracted; consult the source PDF for full content.",metadata
C09000028,5/14/1997,"NATO-Russia Founding Act Pts May 14, 1997",https://foia.state.gov/DOCUMENTS/FOIA_L_Feb2024/FL-2017-13804/DOC_0C09000028/C09000028.pdf,"State Department FOIA record C09000028, dated 5/31/1995, is titled ""Daily Activity Report"". Released under FOIA case F-2017-13804 in the Strobe Talbott collection. Searchable text was not extracted; consult the source PDF for full content.",metadata
C09000038,5/14/1997,NATO-Russia Founding Act Pts,https://foia.state.gov/DOCUMENTS/FOIA_L_Mar2023/FL-2017-13804/DOC_0C09000038/C09000038.pdf,"State Department FOIA record C09000038, dated 5/12/1995, is titled ""Handwritten Note"". Released under FOIA case F-2017-13804 in the Strobe Talbott collection. Searchable text was not extracted; consult the source PDF for full content.",metadata
C09000005,5/16/1997,FRENCH SATISFIED WITH WEU MINISTERIAL RESULTS,https://foia.state.gov/DOCUMENTS/FOIA_L_Apr2024/FL-2017-13804/DOC_0C09000005/C09000005.pdf,"State Department FOIA record C09000005, dated 10/14/1995, is titled ""October 14, 1995 Note from Strobe Talbott to Chris"". Released under FOIA case F-2017-13804 in the Strobe Talbott collection. Searchable text was not extracted; consult the source PDF for full content.",metadata
C09000062,5/19/1997,"May 19, 1997 Note To RDA",https://foia.state.gov/DOCUMENTS/FOIA_L_Feb2024/FL-2017-13804/DOC_0C09000062/C09000062.pdf,"State Department FOIA record C09000062, dated 4/14/1996, is titled ""April 14, 1996 Letter From Jing N. Wu To Bill w/Attached Facsimile Transmission"". The released text begins: ""Jing Wu, who will be visiting Haiti for several days starting May 3. Wu is a specialist in Chinese Chinese traditional medicine.""",pdf
C09000063,5/19/1997,"May 19, 1997 Note From Strobe Talbott To Toby Gati",https://foia.state.gov/DOCUMENTS/FOIA_L_Feb2024/FL-2017-13804/DOC_0C09000063/C09000063.pdf,"State Department FOIA record C09000063, dated 12/10/1995, is titled ""December 10, 1995 Note to Chris"". Released under FOIA case F-2017-13804 in the Strobe Talbott collection. Searchable text was not extracted; consult the source PDF for full content.",metadata
C09000076,5/19/1997,"May 19, 1997 Letter From Boris Yeltsin To William J. Clinton",https://foia.state.gov/DOCUMENTS/FOIA_L_Feb2024/FL-2017-13804/DOC_0C09000076/C09000076.pdf,"State Department FOIA record C09000076, dated 11/22/1995, is titled ""November 22, 1995 Note from Strobe Talbott to Sandy"". Released under FOIA case F-2017-13804 in the Strobe Talbott collection. Searchable text was not extracted; consult the source PDF for full content.",metadata
C09000077,5/19/1997,"May 19, 1997 Letter From Boris Yeltsin To William J. Clinton w/Attachment(s)",https://foia.state.gov/DOCUMENTS/FOIA_L_Feb2024/FL-2017-13804/DOC_0C09000077/C09000077.pdf,"State Department FOIA record C09000077, dated 12/14/1995, is titled ""December 24, 1995 Note from Strobe Talbott to Ambassador Frowick"". Released under FOIA case F-2017-13804 in the Strobe Talbott collection. Searchable text was not extracted; consult the source PDF for full content.",metadata
C09000061,5/22/1997,Berger/Talbott pundits COMPLETE LIST,https://foia.state.gov/DOCUMENTS/FOIA_L_Feb2024/FL-2017-13804/DOC_0C09000061/C09000061.pdf,"State Department FOIA record C09000061, dated 5/8/1995, is titled ""Interview with Andrei Kosyrev"". Released under FOIA case F-2017-13804 in the Strobe Talbott collection. Searchable text was not extracted; consult the source PDF for full content.",metadata
C09000064,5/23/1997,"May 23, 1997 Note From Strobe Talbott To Greg",https://foia.state.gov/DOCUMENTS/FOIA_L_Feb2024/FL-2017-13804/DOC_0C09000064/C09000064.pdf,"State Department FOIA record C09000064, dated 10/14/1995, is titled ""October 14, 1995 Letter from Strobe Talbott to Chris"". Released under FOIA case F-2017-13804 in the Strobe Talbott collection. Searchable text was not extracted; consult the source PDF for full content.",metadata
C09000096,5/25/1997,"May 25, 1997 Note From Strobe Talbott To Pat Kennedy",https://foia.state.gov/DOCUMENTS/FOIA_L_Jan2024/FL-2017-13804/DOC_0C09000096/C09000096.pdf,"State Department FOIA record C09000096, dated 4/19/1995, is titled ""Handwritten Note"". Released under FOIA case F-2017-13804 in the Strobe Talbott collection. Searchable text was not extracted; consult the source PDF for full content.",metadata
C09000098,5/25/1997,"May 25, 1997 Note From Strobe Talbott To Pat Kennedy",https://foia.state.gov/DOCUMENTS/FOIA_L_Jan2024/FL-2017-13804/DOC_0C09000098/C09000098.pdf,"State Department FOIA record C09000098, dated 6/7/1995, is titled ""OFFICIAL - INFORMAL"". The released text begins: ""LEON AND LEON BILL- PLS AND BILL- PLS PASS PASS THE THE FOLLOWING FOLLOWING MESSAGE MESSAGE TO TO MAMEDOV FROM ME MAMEDOV FROM ME WHEN WHEN YOU SEE HIM YOU SEE HIM TOMORROW TOMORROW -- THURSDA Y, THURSDAY. HOPE YOUR YOUR MEETING MEETING GOES GOES WELL -- WE'LL WELL -- LOOK WE'LL LOOK FORWARD TO FORWARD TO HEARING FROM YOU.""",pdf
C09000099,5/25/1997,"May 25, 1997 Note From Strobe Talbott To Stan Roth, Susan Shirk, Alan Romberg",https://foia.state.gov/DOCUMENTS/FOIA_L_Jan2024/FL-2017-13804/DOC_0C09000099/C09000099.pdf,"State Department FOIA record C09000099, dated 5/25/1997, is titled ""May 25, 1997 Note From Strobe Talbott To Stan Roth, Susan Shirk, Alan Romberg"". The released text begins: ""My control officer was Nancy Tucker, a diplomatic historian specializing on U.S.-China relations. She has some good thoughts about our policy, and I urge you to get together with her at some point.""",pdf
C09000079,5/26/1997,"May 26, 1997 Note From Strobe Talbott To Bill Burns",https://foia.state.gov/DOCUMENTS/FOIA_L_Feb2024/FL-2017-13804/DOC_0C09000079/C09000079.pdf,"State Department FOIA record C09000079, dated 7/3/1996, is titled ""Meeting with Polish President Kwasniewski"". The released text begins: ""We We will will emphasize emphasize progress in progress in democratic democratic andand economic economic reforms, reforms, and and will will be be interested to interested to talk talk about about relations relations with Russia Russia i… U.S.-Polish U.S.-Polish relations relations are are probably probably better better now now than at any time in our common history as than at any time in our common as independent independent states. states.""",pdf
C09000097,5/26/1997,"May 26, 1997 Note From Strobe Talbott To Chuck Kartman and Jeff Bader w/Attachment(s)",https://foia.state.gov/DOCUMENTS/FOIA_L_Jan2024/FL-2017-13804/DOC_0C09000097/C09000097.pdf,"State Department FOIA record C09000097, dated 5/1/1995, is titled ""OFFICIAL - INFORMAL"". The released text begins: ""IT WAS BY AND WAS, BY LARGE, PROMISING, AND LARGE, PROMI SING, THOUGH IT THOUGH IT HAD HAD ITS ITS UPS UPS AND AND DOWNS. YOU AND M DID A MAMEDOV DID A SUPERB JOB SUPERB JOB OF OF MANAGING MANAGING THINGS THINGS FROM FROM THERE.""",pdf
C09000041,5/30/1997,"YAVLINSKIY BELIEVES COUP POSSIBLE, - BUT LACKS EVIDENCE OF COUP PLOTTING w/Attached Cover Sheet",https://foia.state.gov/DOCUMENTS/FOIA_L_Oct2024/FL-2017-13804/DOC_0C09000041/C09000041.pdf,"State Department FOIA record C09000041, dated 7/31/1995, is titled ""Strobe Talbott Travels"". Released under FOIA case F-2017-13804 in the Strobe Talbott collection. Searchable text was not extracted; consult the source PDF for full content.",metadata
C09000042,5/30/1997,Dinner with Russian Foreign Minister Primakov,https://foia.state.gov/DOCUMENTS/FOIA_L_Oct2024/FL-2017-13804/DOC_0C09000042/C09000042.pdf,"State Department FOIA record C09000042, dated 5/25/1995, is titled ""May 25, 1995 Letter From Strobe Talbott To Charles"". The released text begins: ""It is is useful useful and welcome. welcome. You understand You unders what's happening what's in Hungary happening in Hungary better better than than just just about about anyone on anyone on earth, earth, so so II appreciate appreciate your your insights and advice.""",pdf
C09000080,6/5/1997,"June 5, 1997 Note From Strobe Talbott To Stu Eizenstat",https://foia.state.gov/DOCUMENTS/FOIA_L_Feb2024/FL-2017-13804/DOC_0C09000080/C09000080.pdf,"State Department FOIA record C09000080, dated 8/5/1996, is titled ""August 5, 1996 Letter From B. Yeltsin To William J. Clinton"". The released text begins: ""You our relations. and II You and have exchanged extremely haveexchanged important letters. extremelyimportant consider your letters. Sound results the end marked the results marked ofthe end of last session the last ofthe session of the Chernomyrdin- Chernomyrdin- Gore Commissio Gore n.""",pdf
C09000081,6/6/1997,Handwritten Note w/Attachment(s),https://foia.state.gov/DOCUMENTS/FOIA_L_Feb2024/FL-2017-13804/DOC_0C09000081/C09000081.pdf,"State Department FOIA record C09000081, dated 10/12/1995, is titled ""October 12, 1995 Memorandum from Strobe Talbott to Deputy Secretary of Defense White W/Attachment(s)"". The released text begins: ""(C) BEGIN BEGIN SUMMARY: SUMMARY: EMBOFF EMBOFF VISITED VISITED HNP HNP STATIONS STATIONS ININ TH NORTH NORTH SEPTEMBER 27-29. EMBOFF FOUND GENERALLY STRONG POPULAR POPULAR SUPPORT SUPPORT FORFOR THE THE HNP HNP AND AND HIGH HIGH MORALE MORALE AMONG AMONG HNP HNP AGENTS AGENTS DESPITE DESPITE MATERIEL MATERIEL SHORTCOMINGS.""",pdf
C09000082,6/9/1997,"June 9, 1997 Letter From Strobe Talbott To Molly Raiser",https://foia.state.gov/DOCUMENTS/FOIA_L_Feb2024/FL-2017-13804/DOC_0C09000082/C09000082.pdf,"State Department FOIA record C09000082, dated 11/1/1995, is titled ""November 1, 1995 Letter from Strobe Talbott to William Perry with WashFax Receipt"". The released text begins: ""SIS## s/s J Message No._____ _ __ Clessifioef ion CONFIDENTIAl CONFIDENTIA1 No. Washington, D.C. 20520 20520 November November 1, 1, 1995 1995 CONFIDENTIAL CONFIDENTIAL Bill, Bill, Thanks for your Thanks for your call from the call from the plane .""",pdf
C09000048,6/10/1997,REFLECTIONS ON BEREZOVSKIY w/Attached Cover Sheet,https://foia.state.gov/DOCUMENTS/FOIA_L_Oct2024/FL-2017-13804/DOC_0C09000048/C09000048.pdf,"State Department FOIA record C09000048, dated 12/22/1995, is titled ""December 22, 1995 Note from Ken Brill to Acting Secretary"". Released under FOIA case F-2017-13804 in the Strobe Talbott collection. Searchable text was not extracted; consult the source PDF for full content.",metadata
C09000083,6/15/1997,"June 15, 1997 Note From Strobe Talbott To Mr. Peter Tarnoff w/Attachment(s)",https://foia.state.gov/DOCUMENTS/FOIA_L_Feb2024/FL-2017-13804/DOC_0C09000083/C09000083.pdf,"State Department FOIA record C09000083, dated 7/20/1995, is titled ""July 20, 1995 Letter From Strobe To John"". The released text begins: ""Joe the Joe Nye and his Nye and his colleagues at at the Department Department of of Defense have Defense have done a superb done a superb job job on on the the agenda and format format for for the the Ministerial. Nowhere Nowhere was this del was this i cate dynamic more apparent delicate apparent than in Chile .""",pdf
C09000085,6/15/1997,"June 15, 1997 Note From Strobe Talbott To Greg Craig",https://foia.state.gov/DOCUMENTS/FOIA_L_Feb2024/FL-2017-13804/DOC_0C09000085/C09000085.pdf,"State Department FOIA record C09000085, dated 2/23/1995, is titled ""Memorandum for Secretary Brown W/Attachment(s)"". The released text begins: ""(b)(6) enne ri Executive Secreta Attachm ents: Attachments: As· stated. Your Your visit visit will will help assuage help assuage Spanish Spanish concerns concern s about about the the importance importa nce we we attach attach toto the bilateral the bilater al relationship. relation ship.""",pdf
C09000087,6/15/1997,"June 15, 1997 Note From Strobe Talbott To Pat Kennedy",https://foia.state.gov/DOCUMENTS/FOIA_L_Feb2024/FL-2017-13804/DOC_0C09000087/C09000087.pdf,"State Department FOIA record C09000087, dated 2/5/1995, is titled ""Handwritten Note with attachment(s)"". Released under FOIA case F-2017-13804 in the Strobe Talbott collection. Searchable text was not extracted; consult the source PDF for full content.",metadata
C09000091,6/16/1997,"June 16, 1997 Note From Strobe Talbott To Bill Burns",https://foia.state.gov/DOCUMENTS/FOIA_L_Feb2024/FL-2017-13804/DOC_0C09000091/C09000091.pdf,"State Department FOIA record C09000091, dated 2/3/1995, is titled ""OFFICIAL - INFORMAL"". The released text begins: ""TOM, I'D I 'D BE BE GRATEFUL If YOU COULD PASS GRATEFUL IF PASS THE THE FOLLOWING FOLL OWING CONFIDENTIAL CONFIDENTIAL NOTE FROM FROM ME TO MAMEDOV. THANKS ALSO, FOR FOR YOUR FINE WORK ON THIS ONE, BEST, YOUR FINE WORK ON THIS ONE.""",pdf
C09000088,6/17/1997,"June 17, 1997 Letter From Sarah Carey To Strobe Talbott",https://foia.state.gov/DOCUMENTS/FOIA_L_Feb2024/FL-2017-13804/DOC_0C09000088/C09000088.pdf,"State Department FOIA record C09000088, dated 12/4/1995, is titled ""Request for First-Class Air Accommodations"". Released under FOIA case F-2017-13804 in the Strobe Talbott collection. Searchable text was not extracted; consult the source PDF for full content.",metadata
C09000089,6/18/1997,Handwritten Note,https://foia.state.gov/DOCUMENTS/FOIA_L_Feb2024/FL-2017-13804/DOC_0C09000089/C09000089.pdf,"State Department FOIA record C09000089, dated 2/5/1995, is titled ""Handwritten Note with attachment(s)"". Released under FOIA case F-2017-13804 in the Strobe Talbott collection. Searchable text was not extracted; consult the source PDF for full content.",metadata
C09000090,6/18/1997,"June 18, 1997 Note From Strobe Talbott To Bob Gelbard",https://foia.state.gov/DOCUMENTS/FOIA_L_Feb2024/FL-2017-13804/DOC_0C09000090/C09000090.pdf,"State Department FOIA record C09000090, dated 3/14/1995, is titled ""March 14, 1995 Letter from Strobe Talbott to Anthony Lake"". Released under FOIA case F-2017-13804 in the Strobe Talbott collection. Searchable text was not extracted; consult the source PDF for full content.",metadata
C09000037,6/19/1997,"June 19, 1997 Note From Strobe Talbott To Jeff Davidow",https://foia.state.gov/DOCUMENTS/FOIA_L_Feb2024/FL-2017-13804/DOC_0C09000037/C09000037.pdf,"State Department FOIA record C09000037, dated 5/29/1995, is titled ""Handwritten Note W/Attachment(s)"". Released under FOIA case F-2017-13804 in the Strobe Talbott collection. Searchable text was not extracted; consult the source PDF for full content.",metadata
C09000037,6/19/1997,"June 19, 1997 Letter To Yuri",https://foia.state.gov/DOCUMENTS/FOIA_L_Mar2023/FL-2017-13804/DOC_0C09000037/C09000037.pdf,"State Department FOIA record C09000037, dated 5/29/1995, is titled ""Handwritten Note W/Attachment(s)"". Released under FOIA case F-2017-13804 in the Strobe Talbott collection. Searchable text was not extracted; consult the source PDF for full content.",metadata
C09000046,6/19/1997,"MEMCON OF SECRETARY ALBRIGHT/RUSSIAN FOREIGN MINISTER PRIMAKOV DINNER AT THE G-8 DENVER SUMMIT, BUCKHORN EXCHANGE, JUNE 19, 1997",https://foia.state.gov/DOCUMENTS/FOIA_L_Oct2024/FL-2017-13804/DOC_0C09000046/C09000046.pdf,"State Department FOIA record C09000046, dated 6/28/1995, is titled ""Strobe Talbott's answer to questions re: Mr. Pifer's security update"". Released under FOIA case F-2017-13804 in the Strobe Talbott collection. Searchable text was not extracted; consult the source PDF for full content.",metadata
C09000030,6/22/1997,"June 22, 1997 Note From Strobe Talbott To Stu Eizenstat",https://foia.state.gov/DOCUMENTS/FOIA_L_Feb2024/FL-2017-13804/DOC_0C09000030/C09000030.pdf,"State Department FOIA record C09000030, dated 6/16/1995, is titled ""June 16, 1995 Letter from Strobe Talbott to Chris"". Released under FOIA case F-2017-13804 in the Strobe Talbott collection. Searchable text was not extracted; consult the source PDF for full content.",metadata
C09000038,6/22/1997,"June 22, 1997 Note From Strobe Talbott To Andrew Weiss",https://foia.state.gov/DOCUMENTS/FOIA_L_Feb2024/FL-2017-13804/DOC_0C09000038/C09000038.pdf,"State Department FOIA record C09000038, dated 5/12/1995, is titled ""Handwritten Note"". Released under FOIA case F-2017-13804 in the Strobe Talbott collection. Searchable text was not extracted; consult the source PDF for full content.",metadata
C09000040,6/22/1997,"June 22, 1997 Note From Strobe Talbott To KP, Jim Collins, Andrew Weiss",https://foia.state.gov/DOCUMENTS/FOIA_L_Feb2024/FL-2017-13804/DOC_0C09000040/C09000040.pdf,"State Department FOIA record C09000040, dated 6/16/1995, is titled ""June 16, 1995 Letter From Strobe Talbott To Jim W/Attachment(s)"". The released text begins: ""STROBE TALBOTT 0 4 WASHINGTON, DC ti WASHINGTON, 1996 J une 16, June 16, 1995 1995 .2 1 DepSeC (11- Ilas Soo Dear Jim: Dear Jim: . II received receive d your your fax fax yesterday. yesterd ay .""",pdf
C09000042,6/22/1997,"June 22, 1997 Note From Strobe Talbott To Bill Burns",https://foia.state.gov/DOCUMENTS/FOIA_L_Feb2024/FL-2017-13804/DOC_0C09000042/C09000042.pdf,"State Department FOIA record C09000042, dated 5/25/1995, is titled ""May 25, 1995 Letter From Strobe Talbott To Charles"". The released text begins: ""It is is useful useful and welcome. welcome. You understand You unders what's happening what's in Hungary happening in Hungary better better than than just just about about anyone on anyone on earth, earth, so so II appreciate appreciate your your insights and advice.""",pdf
C09000043,6/22/1997,"June 22, 1997 Note From Strobe Talbott To Amb. Pickering",https://foia.state.gov/DOCUMENTS/FOIA_L_Feb2024/FL-2017-13804/DOC_0C09000043/C09000043.pdf,"State Department FOIA record C09000043, dated 6/20/1995, is titled ""June 19, 1995 Letter from Strobe Talbott to James Hoge W/Attached Transmission Sheet"". The released text begins: ""I wanted to think about it over the weekend before I wanted to think about it over the weekend before replying replying. . Having Having done done so, so, II bbelieve e lieve wewe should should pull pull the the plug plug on on this this projec project for FA, t for FA, and and I'll I'll try try to to place place the the piece piece somewhere somewhere else. e…""",pdf
C09000041,6/23/1997,"June 23, 1997 Facsimile Transmission From Strobe Talbott To Steve Sestanovich",https://foia.state.gov/DOCUMENTS/FOIA_L_Feb2024/FL-2017-13804/DOC_0C09000041/C09000041.pdf,"State Department FOIA record C09000041, dated 7/31/1995, is titled ""Strobe Talbott Travels"". Released under FOIA case F-2017-13804 in the Strobe Talbott collection. Searchable text was not extracted; consult the source PDF for full content.",metadata
C09000031,6/25/1997,"June 25, 1997 Note From Strobe Talbott To Stu Eizenstat, Dick Morningstar w/Attachment(s)",https://foia.state.gov/DOCUMENTS/FOIA_L_Feb2024/FL-2017-13804/DOC_0C09000031/C09000031.pdf,"State Department FOIA record C09000031, dated 4/12/1995, is titled ""Handwritten Letter W/Attachment(s)"". The released text begins: ""William J • Perry, p erry , Secreta ry of Secretary of Defense. THE THE DEPUTY DEPUTY SECRETARY SECRETAR Y OF OF STATE STATE WASHINGT ON WASHINGTON fJpr Y/ I 1- 7.f' p ~ —31A --;J;vl — - 1 1 /I',.,, i..,>f~J is--1 1"" i.,:aty,A) 'l'---j w-, t._ ,..J (C-<n-rr,_.1 j (..""",pdf
C09000044,6/25/1997,"June 25, 1997 Note From Strobe Talbott To Jeremy Rosner",https://foia.state.gov/DOCUMENTS/FOIA_L_Feb2024/FL-2017-13804/DOC_0C09000044/C09000044.pdf,"State Department FOIA record C09000044, dated 6/21/1995, is titled ""June 21, 1995 Letter from Strobe Talbott to Thomas F. McLarty III W/Attached Facsimile Transmission"". The released text begins: ""(Incl. cover) cover) TO: TO: The The Honorable Honorable Thomas Thomas FF. As As II understand understand it it,, even even the the notion notion ofof milair milair support support ffor or the the NSC - des i g n ated NSC-designated Presidential Presidential Delegation Delegation ttoo the the Menem Menem inaugura…""",pdf
C09000044,6/25/1997,FSB DIRECTOR ON RUSSIAN-IRANIAN MISSILE COOPERATION w/Attached Cover Sheet,https://foia.state.gov/DOCUMENTS/FOIA_L_Oct2024/FL-2017-13804/DOC_0C09000044/C09000044.pdf,"State Department FOIA record C09000044, dated 6/21/1995, is titled ""June 21, 1995 Letter from Strobe Talbott to Thomas F. McLarty III W/Attached Facsimile Transmission"". The released text begins: ""(Incl. cover) cover) TO: TO: The The Honorable Honorable Thomas Thomas FF. As As II understand understand it it,, even even the the notion notion ofof milair milair support support ffor or the the NSC - des i g n ated NSC-designated Presidential Presidential Delegation Delegation ttoo the the Menem Menem inaugura…""",pdf
C09000045,6/27/1997,"June 27, 1997 Note From Strobe Talbott To Greg Craig",https://foia.state.gov/DOCUMENTS/FOIA_L_Feb2024/FL-2017-13804/DOC_0C09000045/C09000045.pdf,"State Department FOIA record C09000045, dated 6/27/1995, is titled ""Security clearance update for Mr Steven Pifer"". The released text begins: ""Vleaae indicate the date rhAr Hr. Mr Pi Mr Pifer worked for Mr.""",pdf
C09000046,6/27/1997,"June 27, 1997 Note To RDA",https://foia.state.gov/DOCUMENTS/FOIA_L_Feb2024/FL-2017-13804/DOC_0C09000046/C09000046.pdf,"State Department FOIA record C09000046, dated 6/28/1995, is titled ""Strobe Talbott's answer to questions re: Mr. Pifer's security update"". Released under FOIA case F-2017-13804 in the Strobe Talbott collection. Searchable text was not extracted; consult the source PDF for full content.",metadata
